{"artifact_id":"report_publication_lock","candidate_manifest_hash":"6bbc8044b43257f96fd868c980ace0ecc6a4cf881795ee1c459163bfc414552c","code":"project_portfolio_health","conformance_hash":"ffaf4847bc6e01903d16baf64865aff45250643d5bfa557fcdd93e4755cd9d93","definition_hash":"4fd66a49d4f843c41fb4da62d14d789e2195bc057af78c0be748ddceb03231f6","previous_manifest_hash":"6bbc8044b43257f96fd868c980ace0ecc6a4cf881795ee1c459163bfc414552c","published_at":"2026-07-26T00:00:00Z","published_manifest_hash":"b9d30b14dc2b6432a1969926d1eb199be0fa90260e1c9108f6a333552a4bcbf5","release_sha":"1111111111111111111111111111111111111111","schema_version":"1.0.0"}
